{
  "allowlist_domains": ["example.com"],
  "blacklist_keywords": ["cam", "leak"],
  "blocked_keywords": ["kids", "gambling"],
  "require_hd_playback_confirmation": true,
  "min_hd_height": 720,
  "max_concurrency": 2,
  "navigation_timeout_ms": 30000,
  "playback_wait_ms": 7000,
  "random_delay_ms_min": 300,
  "random_delay_ms_max": 1200,
  "domain_error_budget": 3,
  "resource_domain_policy": "report",
  "allowed_resource_domains": ["cdn.example.com"],
  "emit_evidence_hash": true,
  "seed_urls": ["https://example.com"],
  "discovery_roots": []
}
